{"active_snapshot_hash":"ef2633136a544639597b2b6792ac640b262dd0bf7761a583e9b7b78e7cac04e1","being_refs":["dm:being:v1:DM9AecCjbNpB6yiILlXsSfBpi7w_4AVRJfqRciByVg4","dm:being:v1:LcLM6ZanhCpu51yB_uog0D9XrvvxYpNs9T-2GpLiNXM","dm:being:v1:sbkmsGShfM_HCrspDcpaCr71fLj9iH2Caw-ng_ELfnY"],"child_grant_id":"dm:relationship-grant:v1:vaOfPbn0p0USarfCUfULFdcfLsEcRHnOKH2M3V2rZ8E","cursor_hash":"8b9NIeuPZc7j_geRQxeHQjRJ5bya_kDnBIxMk_wK3IM","evidence":{"acceptance_event_id":"8147bf6d-ec50-540d-a422-fb275fea8daa","child_acceptance_event_id":"a4044b29-af78-5d20-85b8-512980c6ef02","child_grant_event_id":"cedf9ccd-abee-5568-819b-f8968545f80e","declaration_event_id":"46fb6abd-cb8c-5ab6-acf1-a45a05e1a69d","grant_acceptance_event_id":"c9cb63ce-5461-5b92-b2eb-65756ecb3d1f","grant_event_id":"cd442ee4-149f-5d0c-824e-209ff5414213","membership_event_id":"068a6bf6-5a75-5d1d-a53a-0fd1e0aa3465","message_event_id":"15b2a026-5494-55d2-83df-72b036cc74cb","offer_event_id":"c34af93d-c152-55b6-87d4-20905ee0109d","receipt_event_id":"9e40530c-ef88-5710-9105-3b245eb534a8","resolution_event_id":"c8b28fcd-71c1-5fdb-8d88-2b8072422f1f","revocation_event_id":"dc801996-4a31-54f8-b891-36a5912f1616","transfer_acceptance_event_id":"0bc5ac01-5787-5c55-8773-be310259f6e8","transfer_event_id":"dc456739-4077-5302-ad7e-66ccc7a24746"},"final_history":{"cards":{"dm:being:v1:DM9AecCjbNpB6yiILlXsSfBpi7w_4AVRJfqRciByVg4":{"current":true,"head_event_id":"9faf0039-847c-5c66-a08f-29d2deca8810"},"dm:being:v1:LcLM6ZanhCpu51yB_uog0D9XrvvxYpNs9T-2GpLiNXM":{"current":true,"head_event_id":"ea9aa1a3-3f4a-5901-b64e-e66c8970dcb1"},"dm:being:v1:sbkmsGShfM_HCrspDcpaCr71fLj9iH2Caw-ng_ELfnY":{"current":true,"head_event_id":"c11f0989-b522-5d26-8f06-1d786e3b314b"}},"complete_event_count":17,"evaluated_at_ms":1800000000017,"event_count":17,"forked_event_ids":[],"grants":{"dm:relationship-grant:v1:86kmt-8RjdkkRA8tq5GTEAF_QpreCC3SyZdEVjOo8zQ":"revoked","dm:relationship-grant:v1:vaOfPbn0p0USarfCUfULFdcfLsEcRHnOKH2M3V2rZ8E":"revoked"},"relationships":{"dm:relationship:v1:la9H9s2XvXSIpX7AM0Em7DsSCcYH67SAddjXth3Scl0":"active","dm:relationship:v1:w_XIUmzg-ZOdFxoIyKVH1RMgOdLA4lJeX8T7ecl6bbA":"active"},"schema":"dm.relationship.history-report/v1","tribes":{"dm:tribe:v1:kGbse4ViawzeqrYI-Z8KzabrrximWsrcg5pDwG__BIc":"active"}},"final_snapshot_hash":"54423115fc57724576a18a0581b6c7e64610df7fd70871c8e12b8089db0f5d16","grant_id":"dm:relationship-grant:v1:86kmt-8RjdkkRA8tq5GTEAF_QpreCC3SyZdEVjOo8zQ","invariants":{"ancestor_revocation_cascades":true,"authenticated_intake_creates_signed_delivery":true,"bilateral_consent_before_relationship":true,"delegation_is_strictly_attenuated":true,"distinct_beings":true,"exact_replay_is_idempotent":true,"founder_transfer_is_two_party":true,"grant_requires_subject_acceptance":true,"independent_observer_cursors_converge":true,"membership_separate_from_grant":true,"no_external_contact":true,"recipient_encrypted_delivery_opens_only_after_grant":true,"revocation_blocks_disclosure_before_sealing":true,"revocation_refuses_stale_direct_and_hub_forward":true,"revocation_survives_restart":true,"route_ack_is_not_consent":true,"route_ack_is_not_semantic_delivery":true},"relationship_id":"dm:relationship:v1:la9H9s2XvXSIpX7AM0Em7DsSCcYH67SAddjXth3Scl0","schema":"dm.synthetic-relationship-report/v1","tribe_ref":"dm:tribe:v1:kGbse4ViawzeqrYI-Z8KzabrrximWsrcg5pDwG__BIc"}
